{
  "A_institutions_sources": [
    "Polytechnique Montréal",
    "Université de Montréal",
    "MILA",
    "HEC Montréal",
    "École de technologie supérieure ETS",
    "McGill University",
    "Concordia University",
    "Université Laval",
    "Université de Sherbrooke",
    "INRS",
    "École nationale d'administration publique ENAP",
    "UQAM",
    "UQTR",
    "UQAC",
    "UQAR",
    "UQO",
    "UQAT",
    "TÉLUQ",
    "Bishop's University",
    "Cégep network Québec",
    "CCTT network",
    "Colleges and Institutes Canada members",
    "Universities Canada members",
    "Données Québec",
    "Open Government Canada",
    "Statistics Canada",
    "Répertoire des municipalités du Québec",
    "Montréal",
    "Québec City",
    "Laval",
    "Sherbrooke",
    "Trois-Rivières",
    "Saguenay",
    "Gatineau",
    "Rimouski",
    "Val-d'Or",
    "Hydro-Québec",
    "Investissement Québec",
    "Ministère de l'Économie Québec",
    "Ministère de l'Environnement Québec",
    "Natural Resources Canada",
    "Environment and Climate Change Canada",
    "Innovation Science and Economic Development Canada",
    "Canadian Space Agency",
    "National Research Council Canada",
    "CRIQ",
    "Prompt Québec",
    "IVADO",
    "Scale AI",
    "Québec AI Institute ecosystem",
    "Optonique",
    "Aéro Montréal",
    "Propulsion Québec",
    "Batteries/Bécancour ecosystem",
    "Aluminium Valley",
    "Mining innovation clusters",
    "Clean tech associations",
    "Water technology organizations",
    "Municipal innovation labs",
    "Indigenous organizations and councils",
    "Cooperatives and social economy groups",
    "Healthcare and hospital research centers",
    "Agriculture and agri-food innovation networks",
    "Port and maritime organizations"
  ],
  "B_challenges_sectors": [
    "clean electricity optimization",
    "grid resilience",
    "energy storage",
    "battery materials",
    "hydrogen systems",
    "wind integration",
    "solar integration",
    "district heating",
    "building energy efficiency",
    "industrial heat recovery",
    "water treatment",
    "selective chemical separation",
    "mine water remediation",
    "PFAS and emerging contaminants",
    "wastewater optimization",
    "drinking water resilience",
    "climate adaptation",
    "flood risk",
    "wildfire risk",
    "urban heat islands",
    "carbon accounting",
    "circular economy",
    "advanced recycling",
    "critical minerals",
    "aluminium decarbonization",
    "green mining",
    "materials discovery",
    "nanomaterials",
    "photonics",
    "optoelectronics",
    "Raman spectroscopy",
    "sensors and metrology",
    "quantum technologies",
    "plasma systems",
    "fractal LC circuits",
    "power electronics",
    "GaN/SiC devices",
    "robotics",
    "autonomous manufacturing",
    "microfabrication",
    "industrial AI",
    "open data governance",
    "public service optimization",
    "municipal digital twins",
    "geospatial analytics",
    "transport electrification",
    "EV charging networks",
    "aerospace systems",
    "space technologies",
    "satellite data",
    "northern infrastructure",
    "food systems",
    "agri-tech",
    "health data governance",
    "biomedical instrumentation",
    "education games",
    "STEM outreach",
    "research reproducibility",
    "cybersecurity defense",
    "privacy-preserving data sharing",
    "supply chain resilience",
    "lab-to-market translation",
    "SME productivity",
    "rural development"
  ],
  "C_ai7_capabilities": [
    "HFMC compression",
    "HFMC-DIC-Tri-TZM",
    "FFWT reversible transforms",
    "least-action hypergraph selection",
    "tensor factorization GF2",
    "hypergraph knowledge graph",
    "Yggdrasil canon registry",
    "AI-7 bot orchestration",
    "Power score engine",
    "privacy gate",
    "license gate",
    "source registry",
    "CKAN connector",
    "institution extractor",
    "sector classifier",
    "geospatial mapper",
    "dataset linker",
    "claim extractor",
    "equation extractor",
    "dimension verifier",
    "contradiction engine",
    "test generator",
    "benchmark runner",
    "DCT packet builder",
    "partnership dossier builder",
    "delta report generator",
    "canonical ZIP governance",
    "Drive/GitHub bridge",
    "GitHub PR safety gate",
    "workflow hardening",
    "sandbox runner",
    "read-only ingestion",
    "manual review queue",
    "outreach compliance gate",
    "interactive hyperatlas UI",
    "Yggdrasil explorer",
    "educational quest engine",
    "fractal LC simulator",
    "circuit graph spectral analyzer",
    "water-treatment prototype planner",
    "energy digital twin",
    "materials graph miner",
    "Raman calibration pipeline",
    "optoelectronic design assistant",
    "municipal climate dashboard",
    "industry synergy miner",
    "funding program matcher",
    "project-to-institution recommender",
    "open-data-to-prototype mapper",
    "risk score engine",
    "rollback ledger",
    "audit receipt generator",
    "semantic deduplication",
    "source freshness checker",
    "API quota governor",
    "beam-search opportunity optimizer",
    "multi-objective optimizer",
    "simulation report builder",
    "PDF dossier generator",
    "HTML portal exporter",
    "knowledge compression codec",
    "mycelial dictionary builder",
    "counterexample registry",
    "falsifiability matrix"
  ],
  "D_actions_governance": [
    "seed node",
    "verify source",
    "normalize metadata",
    "classify sector",
    "map jurisdiction",
    "attach licence",
    "attach provenance",
    "score power",
    "score risk",
    "privacy review",
    "license review",
    "deduplicate",
    "create hyperedge",
    "generate opportunity",
    "generate prototype brief",
    "generate partnership dossier",
    "create DCT packet",
    "create test plan",
    "create benchmark",
    "create simulation",
    "link dataset",
    "link funding program",
    "link municipal need",
    "link university lab",
    "link industry cluster",
    "link AI-7 project",
    "mark no outreach",
    "queue manual outreach review",
    "create public summary",
    "create private review note",
    "promote to candidate",
    "promote to verified",
    "promote to crystallizable",
    "promote to stable",
    "archive low confidence",
    "reject privacy risk",
    "request missing licence",
    "request source refresh",
    "generate delta report",
    "update canon registry",
    "open GitHub issue",
    "open GitHub PR",
    "add unit tests",
    "add schema tests",
    "add CI gate",
    "add CODEOWNERS rule",
    "add SECURITY rule",
    "add rollback receipt",
    "add audit log",
    "export JSON",
    "export CSV",
    "export GraphML",
    "export HTML dashboard",
    "export Markdown dossier",
    "export PDF dossier",
    "sync read-only source",
    "run no-network dry run",
    "run CKAN pilot",
    "run municipal pilot",
    "run university pilot",
    "run industry-gated pilot",
    "run energy-water-climate pilot",
    "review by human",
    "decide next action"
  ],
  "count_per_axis": 64,
  "total_combinations": 16777216,
  "generated_at": "2026-04-28"
}
